,Id,ProductId,UserId,ProfileName,HelpfulnessNumerator,HelpfulnessDenominator,Score,Time,Summary,Text,Anger,Disgust,Fear,Joy,Sadness,Analytical,Confident,Tentative,Openness,Conscientiousness,Extraversion,Agreeableness,Emotional Range
48,49,B001EO5QW8,ALOR97KTZTK1P,knitty pants,1,2,4,1191715200,Very good but next time I won't order the Variety Pack,"I really like the Maple and Brown Sugar flavor. The regular is fine with brown sugar added. The Apples and Cinnamon flavor is OK. This is a very quick, easy and satisfying breakfast and I'll order this brand again, but not the variety. I'll get all Maple and Brown Sugar.",0.057187,0.043974,0.027521,0.801285,0.047812,0.372697,0.862626,0.0,0.986723,0.677279,0.749345,0.409266,0.88905
49,50,B001EO5QW8,A276999Y6VRSCQ,JMay,0,1,3,1334016000,Same stuff,This is the same stuff you can buy at the big box stores.  There is nothing healthy about it.  It is just carbs and sugars.  Save your money and get something that at least has some taste.,0.13231,0.299857,0.112648,0.203186,0.362914,0.0,0.0,0.975179,0.796106,0.806273,0.40847,0.561821,0.810389
50,51,B001EO5QW8,A108P30XVUFKXY,Roberto A,0,7,1,1203379200,Don't like it,"This oatmeal is not good. Its mushy, soft, I don't like it. Quaker Oats is the way to go.",0.162575,0.069733,0.110304,0.146838,0.446742,0.025586,0.0,0.733641,0.628699,0.699603,0.148105,0.34832,0.517694
51,52,B000G6RPMY,A3S5KJDA6ED2PS,Mike Kaser,4,4,5,1243900800,HOT!  And good!  Came back for more  :),"Got a free package of these with a bottle of bloody mary mix I bought from the seller, and the advertising worked..lol,  I tried them, and shared them with 2 buddies, and we all loved them...  So im here to buy more, and noticed there were no reviews yet,...  well now there is.  They are Hot,  but not ""burn your mouth forever hot""  its a nice temp...  Perfect for us..",0.035091,0.013116,0.018067,0.792028,0.15561,0.0,0.888493,0.0,0.882129,0.969626,0.7185,0.944916,0.721958
52,53,B000G6RPMY,A9L6L5H9BPEBO,Edwin C. Pauzer,1,1,4,1348876800,You'll go nuts over Ass-Kickin' Peanuts.,"This wasn't in stock the last time I looked. I had to go to the Vermont Country Store in Weston to find it along with a jaw harp, Cranberry Horseradish Sauce, Fartless Black Bean Salsa, Apple Cider Jelly, Newton's Cradle Art in Motion and the staple Vermont Maple Syrup.<br /><br />Back to the Ass Kickin Peanuts. They are hot. They will activate the perspiration glands behind your ears and under your arms. It requires a beverage as advertised, a glass of very cold milk, and a box of Kleenex since it will make your nose run. They look like ordinary peanuts which is already giving me ideas for work. I suspect that some people have been hitting my goodies in my absence, especially my colleague Greg. I'm going to take this to work at earliest opportunity and empty the contents of this can into an ordinary Planters Peanuts can, and then see whose crying or whose nose is running when I return.<br /><br />The can should be shaken to ensure the spices are evenly distributed. It is important to wash your hands after consumption and not touch the eyes.<br /><br />You'll go nuts over these Ass-Kickin' Peanuts.<br /><br />P.S. I'm not sharing the peanuts, not deliberately, and I'll probably give Greg the jaw harp for Christmas. He'll be so insulted.",0.723809,0.682279,0.098012,0.125343,0.709158,0.0,0.0,0.432694,0.826536,0.822993,0.392287,0.059046,0.707999
53,54,B000G6RPMY,AQ9DWWYP2KJCQ,"Roel Trevino ""protomex""",0,0,3,1278028800,not ass kickin,we're used to spicy foods down here in south texas and these are not at all spicy.  doubt very much habanero is used at all.  could take it up a notch or two.,0.084404,0.159421,0.07195,0.218068,0.234848,0.0,0.0,0.979015,0.87157,0.681596,0.917321,0.692075,0.589448
54,55,B002GWHC0G,A1ND7WC5LXOU48,"David Belton ""Proteus 1""",2,2,4,1322438400,Roasts up a smooth brew,"I roast at home with a stove-top popcorn popper (but I do it outside, of course). These beans (Coffee Bean Direct Green Mexican Altura) seem to be well-suited for this method. The first and second cracks are distinct, and I've roasted the beans from medium to slightly dark with great results every time. The aroma is strong and persistent. The taste is smooth, velvety, yet lively.",0.045697,0.028704,0.088559,0.770991,0.080307,0.268269,0.718218,0.0,0.931114,0.799713,0.819428,0.115125,0.632509
55,56,B002GWHC0G,A2EFAW1P3DRXWO,TJ Fairfax,0,0,5,1349395200,Our guests love it!,"We roast these in a large cast iron pan on the grill (about 1/3 of the bag at a time).  The smell is wonderful and the roasted beans taste delicious too.  More importantly, the coffee is smooth; no bitter aftertaste.  On numerous occasions, we've had to send the roasted beans home with friends because they like it so much.",0.011814,0.074041,0.007283,0.896886,0.012936,0.611644,0.0,0.102083,0.958639,0.84934,0.875321,0.513918,0.87302
56,57,B004N5KULM,A202WR509428VF,amateur amazon shopper,2,2,5,1322438400,Awesome Deal!,Deal was awesome!  Arrived before Halloween as indicated and was enough to satisfy trick or treaters.  I love the quality of this product and it was much less expensive than the local store's candy.,0.02039,0.005861,0.052431,0.764169,0.136314,0.717828,0.0,0.725918,0.788149,0.291254,0.352392,0.354343,0.770047
57,58,B004N5KULM,ASCNNAJU6SXF8,S. Beck,1,1,5,1336176000,How can you go wrong!,"It is chocolate, what can I say.  Great variety of everything our family loves.  With a family of six it goes fast here.  Perfect variety.  Kit Kat, Reeses, take five and more.",0.028368,0.002977,0.030234,0.862468,0.068931,0.2041,0.869578,0.0,0.745318,0.798707,0.47167,0.701846,0.449125
58,59,B004N5KULM,A2A7KXM9B4XW90,"P. Kelso ""Amazon all the way!""",0,0,5,1320364800,Awsome - Kids in neighborhood loved us!,"Great product, nice combination of chocolates and perfect size!  The bags had plenty, and they were shipped promptly.  The kids in the neighborhood liked our candies!",0.013166,0.029204,0.004344,0.898548,0.041578,0.472718,0.901164,0.0,0.925951,0.427825,0.35977,0.484197,0.675292
59,60,B004N5KULM,A2QOGOXPOVKAJG,mimimc,0,0,5,1320105600,great deal.,"Halloween is over but, I sent a bag to my daughters class for her share. The chocolate was fresh and enjoyed by many.",0.046709,0.028284,0.006438,0.885232,0.032839,0.0,0.0,0.0,0.864872,0.925448,0.829599,0.984391,0.753009
60,61,B004N5KULM,A1ZR8O62VSU4OK,"Lisa J. Szlosek ""lisa""",2,4,3,1318723200,Better price for this at Target,"Watch your prices with this.  While the assortment was good, and I did get this on a gold box purchase, the price for this was<br />$3-4 less at Target.",0.02101,0.00791,0.035516,0.251483,0.043262,0.0,0.0,0.0,0.530662,0.854577,0.83663,0.419086,0.988461
61,62,B004N5KULM,A7ZK2A3VIW7X9,Peggy,0,2,5,1319414400,pretty expensive,"This bag of candy online is pretty expensive, it should be cheaper in order to compete with grocery stores, other than that, its a good combination of my favorite candy",0.08555,0.240425,0.026795,0.375626,0.301799,0.445104,0.0,0.323642,0.936813,0.928265,0.56805,0.155941,0.952033
62,63,B001EO5TPM,A1E09XGZUR78C6,gary sturrock,2,2,1,1215302400,stale product.,Arrived in 6 days and were so stale i could not eat any of the 6 bags!!,0.143979,0.055029,0.024338,0.487535,0.18422,0.0,0.0,0.873263,0.351824,0.385502,0.000268,0.089493,0.037193
63,64,B005DUM9UQ,A3HR0ZZOFKQ97N,RLC,3,3,5,1333497600,Hammer Nutrition 's Fizz Rocks!,"I have used the endurolyte product for several years in both pill and powder form.  Long desert rides on the dirt bike always found my camelbak water heavily laced with the endurolyte powder, not overly tasty, but quite effective, as I never got a cramp on these several hundred mile rides.  Same for desert racing in the buggy, the camelbaks were always laced with the powder.  Now we have the Fizz...what a great product!  Firstly, its Hammer's endurolyte product so it's great, endurance athlete's the world over use their products. Second its convenient, handly tablets that dissovle in a fizz.  Third it tastes great! Imagine getting a nice cool drink when your body is starving for hydration and electrolytes and rather than getting a ""salty"" taste, you get a refreshing lemon-lime or mango!  The camelbaks always get the Fizz now.  I also drop a tablet in my bottled water whenever I exercise and have a nice flavored water chock full of electrolytes. I cannot recommend this product or any hammer product highly enough.",0.088138,0.05153,0.073023,0.649338,0.156003,0.532558,0.0,0.0,0.800817,0.157972,0.192456,0.000436,0.541259
64,65,B005DUM9UQ,A2XIHNXODNZGV4,"ChemProf ""chem professor""",1,1,5,1333584000,great source of electrolytes,This product serves me well as a source of electrolytes during and after a long run or bike ride.<br />I have tried all of the flavors but really do like the grapefruit flavor... no after-taste and I actually like the slight carbonation.<br />I use other Hammer products and really like their whole product line.,0.02927,0.002181,0.077362,0.671396,0.058093,0.413928,0.0,0.721968,0.828437,0.664863,0.073747,0.000735,0.768652
65,66,B005DUM9UQ,A3TWF9DQ6MU87E,dhy4b,1,1,5,1331510400,Great for preventing cramps,This stuff really works for preventing cramping during the middle to latter stages of your rides. Pop 1 into each water bottle and you're set. Flavor is fine and goes down easy.,0.137103,0.050752,0.233743,0.438277,0.195361,0.0,0.0,0.0,0.749137,0.294212,0.472909,0.002339,0.428188
66,67,B005DUM9UQ,AEFIZIJ1FK1BK,Doug,0,0,5,1345161600,Low Carb Alternative to Gatorade,"For those of us on a low carb diet these little tablets are just the thing.<br /><br />Two years ago I started cycling again after many years but was having heart arrhythmia after longer rides in high heat.  I was drinking plain water but did a little research and thought electrolytes might be the issue.  Gatorade wasn't an option because it is so loaded with carbohydrates so I looked around for a low-carb alternative.  The ""zero carb"" sports drinks didn't help so what to do?  One day I ran across these at my bike shop so tried a tube of them.....voila!...problem solved!!<br /><br />I've shared them with two friends in particular whose problems with leg cramps were resolved while using these.<br /><br />These guys got it right -- they are superbly formulated and simply work.....",0.046763,0.002992,0.101727,0.109207,0.160902,0.0,0.0,0.80186,0.334181,0.391141,0.180865,0.019685,0.579528
67,68,B005DUM9UQ,A8OFFIAL6XTOH,Bill Shirer,0,1,2,1338422400,Taste is not so good.,"I purchased the Mango flavor, and to me it doesn't take like Mango at all.  There is no hint of sweetness, and unfortunately there is a hint or aftertaste almost like licorice.  I've been consuming various sports nutrition products for decades, so I'm familiar and have come to like the taste of the most of the products I've tried.  The mango flavor is one of the least appealing I've tasted.  It's not terrible, but it's bad enough that I notice the bad taste every sip I take.",0.046116,0.13062,0.036586,0.15974,0.761364,0.24825,0.0,0.762985,0.927287,0.114537,0.002965,0.047345,0.08428
68,69,B000E7VI7S,A1KL2LAW08X6UQ,calmnsense,0,0,3,1169251200,How much would you pay for a bag of chocolate pretzels?,"If you're impulsive like me, then $6 is ok. Don't get me wrong, the quality of these babies is very good and I have no complaints. But in retrospect, the price is a little ridiculous (esp. when you add on the shipping).",0.10935,0.085591,0.054673,0.500432,0.173412,0.723207,0.711603,0.0,0.860761,0.150319,0.95601,0.355562,0.16211
69,70,B000E7VI7S,AWCBF2ZWIN57F,C. Salcido,0,2,5,1185753600,pretzel haven!,this was sooooo deliscious but too bad i ate em too fast and gained 2 pds! my fault,0.252695,0.411445,0.288219,0.016591,0.385865,0.0,0.0,0.0,0.035195,0.059946,0.147355,0.377792,0.018535
70,71,B001GVISJC,A27TKQHFW0FB5N,Chet,2,2,5,1254355200,Great Gummi!,"These Albanese gummi bears and rings and so on are very good and tasty and high quality. The bears even have little faces. At my local candy store this type of gummi stuff (bears, rings, snakes, balls, worms, whatever) are about $10/lb. These twin packs of 4.5 or 5 pound bags is a screaming deal as far as I'm concerned. I'm probably 50 pounds deep in these friggin' things. Consumed!",0.43675,0.459234,0.231737,0.490069,0.456519,0.087962,0.0,0.817234,0.910769,0.017652,0.651555,0.127478,0.012521
71,72,B001GVISJC,A3BDOAPSF96WGQ,2tall,1,1,5,1289260800,Bigger then other brands,"Grape gummy bears are hard to find in my area. In fact pretty much anyone I talk to about grape gummy bears they think I'm lying. So I bought 10lbs... : ) These bears are a little bit bigger then the other brands and have kind of sour kick, but nothing to strong. I love grape flavored candy/soda and these are pretty good. There is another company that makes grape gummy bears that are a little bit better in my opinion, but these are well worth it for the price. I like to use the gummy bears in home made Popsicles with flavored sports drink. The salt in the sports drink makes for softer popsicles, and the gummy bears are awesome frozen. They are delicious!",0.121438,0.152,0.078456,0.665056,0.456696,0.329439,0.0,0.914779,0.944852,0.354664,0.64315,0.30178,0.413837
72,73,B006SQBRMA,ATYMT48R62ENE,Marie,0,0,5,1327017600,Best ever latice tart,"I ordered two of these and two of raspberry latice tarts directly from FantasiCakes website for a dinner party I was hosting. It arrived fresh and intact. Very good size. I froze half for later use. I am a pastry lover and these were the best I've ever tasted. The pastry was soft, the jam was really good and the taste was great. They were gone in no time. My guests were really impressed.",0.118685,0.060541,0.117571,0.694942,0.167012,0.312884,0.843719,0.0,0.77543,0.966522,0.302385,0.5323,0.804155
73,74,B0059WXJKM,A25VFHVGI4CFTP,Diana Robinson,0,1,1,1335744000,Warning!  WARNING!  -ALCOHOL SUGARS!,"Buyer Beware Please! This sweetener is not for everybody.  Maltitol is an alcohol sugar and can be undigestible in the body.  You will know a short time after consuming it if you are one of the unsuspecting many who cannot digest it by the extreme intestinal bloating and cramping and massive amounts of gas a person can experience. Nausea, diarrhea & headaches can also be experienced. I learned my lesson the hard way years ago when I fell in love with the sugar-free chocolates suzanne sommers used to sell.  I thought I'd found sugar-free chocolate nirvana at first taste but the bliss was short lived when the terrible side effects of maltitol kicked in.  The discomfort was unlike anything I had ever felt before.  I blew up like a balloon and had very painful abdominal cramping.  As the symptoms passed, this too was very unpleasant.  Though hard for me to believe a low calorie sweetener could be the culprit, all symptoms were gone when I stopped eating the chocolate. My hunch it had something to do with the maltitol were unfortunately confirmed for me about a year later when I purchased some delicious sugar-free popcorn at my local market.  The taste was amazing and while I was looking at the label wondering what could possibly make this yummy, new sugarfree treat taste so good, my heart sank when I followed the little asterisk next to sugarfree sweetener* down to the very bottom of the label and read ""maltitol"" in tiny little letters! Thank goodness I'd eaten only a little. I still ended up with all the same side-effects but for a much shorter duration. Some people can use maltitol to their heart's content but others, like me, can have a bad reaction to it. In case you're like me, ... it's not you ...it's the maltitol!",0.106434,0.092314,0.478179,0.614451,0.539872,0.583679,0.0,0.714538,0.74883,0.151731,0.072975,0.545013,0.144821
74,75,B001EPPI84,A3Q0IDQ03S0158,Jen,0,0,2,1287705600,nothing special,It is okay.  I would not go out of my way to buy it again,0.142689,0.170041,0.050714,0.256935,0.285838,0.047545,0.0,0.0,0.126518,0.720093,0.000273,0.808321,0.683977
75,76,B001EPPI84,A27TZ4WBU7N0YF,I. So,0,0,1,1275004800,No Tea Flavor,No tea flavor at all. Just whole brunch of artifial flavors. It is not returnable. I wasted 20+ bucks.,0.445723,0.256937,0.136189,0.131768,0.303515,0.08963,0.0,0.0,0.544688,0.488932,0.457354,0.19965,0.652342
76,77,B004X2KR36,A2W3ABLWMJ84NS,Jessica Snyder,0,0,5,1348444800,Good,"These looked like a perfect snack to through in with my trail mix.  Unfortunately, they arrived in a solid mass of melted chocolate.  I left them in my pantry for a few days, and when I opened them at room temperature they were still gooey.  I through them in the fridge and I've been breaking off hunks ever since.  They taste good to me, but the chocolate is all grainy after melting and then solidifying again.  I won't order them online again, but if I see them in a store I would pick them up.",0.10886,0.103716,0.114719,0.572921,0.606581,0.477226,0.794212,0.0,0.378241,0.850987,0.006084,0.365575,0.249944
77,78,B004X2KR36,A26M5O53PHZTKN,"Debs ""peanut""",0,0,5,1348185600,Taste great,These taste really good. I have been purchasing a different brand and these are very similar in taste and texture. I agree with the other reviewer regarding ordering in the summer. There is no insulating packaging with ice packs so they will melt in warm weather like all chocolate food items. Order in cold weather and buy enough to last!!!,0.054767,0.047071,0.005228,0.70567,0.207498,0.320223,0.828525,0.0,0.944458,0.409509,0.311806,0.249884,0.077934
78,79,B004X2KR36,A2AB7M9UCNBVN7,sharonh4,0,0,3,1346976000,Order only in cold weather,"The taste was great, but the berries had melted.  May order again in winter. If you order in cold weather you should enjoy flavor.",0.054602,0.031849,0.012424,0.730084,0.144593,0.632483,0.0,0.865388,0.889331,0.818851,0.182347,0.685935,0.867111
79,80,B005R8JE8O,A3H1EQD2PBC085,jmc,0,0,5,1344902400,this is the best,"i know i cannot make tea this good.  granted, i am not from the south but i know i have never enjoyed tea that was this sweet without being too sweet.  it tastes crisp.",0.012205,0.042555,0.01205,0.843459,0.075353,0.668742,0.701849,0.0,0.192372,0.603378,0.025568,0.973207,0.380877
80,81,B0066DMI6Y,AB30HQTI5VOLR,Melinda Bishop,1,1,5,1325116800,Delicious!,This peppermint stick is delicious and fun to eat.  My dad got me one for Christmas because he remembered me having a similar one when I was a little girl.  I'm 30 now and I love it!,0.003312,0.011377,0.007804,0.798077,0.183809,0.72612,0.0,0.0,0.291602,0.188073,0.557443,0.973394,0.034466
81,82,B0066DMI6Y,AZLONLC8OZPEC,John W. Hollis,1,1,4,1324598400,Great,"Great gift for all ages! I purchased these giant canes before and the recipients loved them so much, they kept them and would not eat them.",0.012786,0.003822,0.01185,0.841117,0.12369,0.0,0.901164,0.0,0.680159,0.78308,0.422617,0.976493,0.604386
82,83,B003ZFRKGO,A2VOZX7YBT0D6D,"Johnnycakes ""Johnnycakes""",15,15,5,1325635200,Forget Molecular Gastronomy - this stuff rockes a coffee creamer!,"I know the product title says Molecular Gastronomy, but don't let that scare you off.  I have been looking for this for a while now, not for food science, but for something more down to earth.  I use it to make my own coffee creamer.<br /><br />I have to have my coffee blonde and sweet - but the flavored creamers are full of the bad kinds of fat, and honestly, I hate to use manufactured ""food"" items.  I really don't think they are good for the body.  On the other hand, I hate using cold milk or cream, because I like HOT coffee.<br /><br />I stumbled across this on Amazon one day and got the idea of making my own creamer.  I also bought low-fat (non-instant) milk powder and regular milk powder. The non-instant lowfat milk is a little sweeter and tastes fresher than regular instant low-fat milk, but does not dissolve good in cold water - which is not a problem for hot coffee.  You will have to play with the ratios - I would not do just the heavy cream, it made the coffee too rich. Also, I think the powder is too expensive to just use on it's own. I like mixing 1/3 of each together.<br /><br />For flavoring, I bough cocoa bean powder, vanilla bean powder, and caster (superfine) sugar.  I mix up small batches along with spices like cinnamon and nutmeg to make my own flavored creamers.  If you wanted, you could use a fake sweetner powder instead.  I make up small amounts that I store in jelly canning jars. I also use my little food chopper/food processor to blend everything, so the sugar is not heavier and sinks to the bottom.  Let it settle for a bit before opening the top though.<br /><br />This stuff tastes WAY better than the storebought creamers and it is fun to experiment and come up with your own flavors.  I am going to try using some essential oils next and see if I can get a good chocolate/orange mix.<br /><br />All of the ingredients I mentioned are here online.  Take the time to experiment.  Maybe you don't use any low-fat milk. Or don't add any flavorings.  It is up to you.  Also, would make great housewarming/host(ess) gifts.<br /><br />I am sure other molecular people will be able to tell you more of what you can do with it, and I am sure I will experiment with it in cooking - but the main reason I bought it was to make my own creamer and it worked out great.",0.125592,0.471208,0.099251,0.588326,0.162364,0.0,0.0,0.501007,0.713065,0.723975,0.249372,0.066203,0.652199
83,84,B0019CW0HE,A1FD9E5C06UB6B,BRENDA DEMERS,5,5,3,1301011200,Natural Balance Lamb and Rice,"While my dogs like all of the flavors that we have tried of this dog food, for some reason their itching increased when I tried the lamb and rice. I have some very itchy dogs and am giving them a limited ingredient dog food to try to help. The duck and sweet potato cut down on the itching significantly, but when we tried lamb and rice they started itching more once again. I like Natural Balance for the quality ingredients.",0.042088,0.044561,0.053057,0.610895,0.268791,0.590249,0.0,0.820341,0.858738,0.757117,0.043668,0.329382,0.197395
84,85,B0019CW0HE,AK2CXHH9VRZ2A,I. GLENN,4,4,3,1313193600,INCREASED MY DOGS ITCHING,"Awesome dog food. However, when given to my ""Boston"", who has severe reactions to some food ingredients; his itching increased to violent jumping out of bed at night, scratching. As soon as I changed to a different formula, the scratching stopped. So glad Natural Balance has other choices. I guess you have to try each, until you find what's best for your pet.",0.077166,0.020162,0.054219,0.786973,0.083064,0.722389,0.0,0.73225,0.412767,0.560124,0.54117,0.909044,0.110321
85,86,B0019CW0HE,A25BGFRHYHEZKK,Toby's mom,4,4,5,1292889600,Great food!,"We have three dogs and all of them love this food!  We bought it specifically for one of our dogs who has food allergies and it works great for him, no more hot spots or tummy problems.<br />I LOVE that it ships right to our door with free shipping.",0.010816,0.00607,0.068136,0.853671,0.025443,0.0,0.0,0.0,0.790718,0.997084,0.681239,0.784651,0.678612
86,87,B0019CW0HE,A37N9XZBB8JYOF,Ash52,1,1,5,1333670400,Great for my dogs allergies,"My dog has a ton of allergies both environmental and food. She was on a prescription dog food before we had her tested to see what allergies she has. After we got the test back, we learned she was allergic to something in the prescription brand. So I finally found this dog food and she has done so well on this! She still has her environmental triggers, but I am happy she can finally eat something I know won't cause her pain.",0.04641,0.022053,0.073896,0.796368,0.090866,0.584719,0.0,0.706892,0.499956,0.700768,0.021672,0.800633,0.044215
87,88,B0019CW0HE,A1T4L0Q47OZ9N,Wendy,1,1,5,1320883200,Great for stomach problems!,My shepherd/collie mix has IBS.  Our vet recommended a limited ingredient food.  This has really helped her symptoms and she likes it.  I will always buy it from Amazon...it's $10 cheaper and free shipping!,0.017176,0.055584,0.010752,0.208347,0.607586,0.324507,0.848841,0.0,0.869693,0.748578,0.052749,0.647177,0.437204
88,89,B0019CW0HE,A3IMXZE9FCUNOC,Dana,1,1,5,1311638400,Better life for you dog!,Natural Balance Dry Dog Food Lamb Meal and Brown Rice Recipe did wonders for my Jack Russell. She has awful food allergy's and this food was our last hope because it was the last food we could find that didn't have SOMETHING in it that she was allergic to. She has no problem eating it dry but normally I mix the Natural Balance Dry Lamb and Brown Rice with the Natural Balance Wet Lamb and Brown Rice.. she seems to like that better. We started feeding it to our other dog (a Bichon) too and she loves it. If your dog has allergy's or stomach issue.. or if you want your dog to eat better food-- this is it! You will see a difference in your pet.,0.070517,0.121624,0.097375,0.641639,0.487288,0.652693,0.0,0.909888,0.79757,0.749249,0.625457,0.802624,0.443906
89,90,B0019CW0HE,A1EC57S6C2VLTL,"Lorraine ""Agelechio""",0,0,5,1347408000,Great Food,"Great food! I love the idea of one food for all ages & breeds. t's a real convenience as well as a really good product.  My 3 dogs eat less, have almost no gas, their poop is regular and a perfect consistency, what else can a mom ask for!!",0.011705,0.10693,0.020707,0.853625,0.028988,0.94236,0.880065,0.0,0.443852,0.46988,0.605614,0.420368,0.412138
90,91,B0019CW0HE,A1OGD72Y2Y26CF,Lisas201,0,0,5,1335398400,Great food for my my dog who has a sensitive stomach.,I have a standard poodle and pomeranian who both do wonderful on this food. I have switched them to a different food (due to price) a couple of times and end up going right back to natural balance.,0.031151,0.009285,0.056388,0.488507,0.198848,0.430175,0.264129,0.0,0.300067,0.590356,0.545671,0.557007,0.140169
