,Id,ProductId,UserId,ProfileName,HelpfulnessNumerator,HelpfulnessDenominator,Score,Time,Summary,Text,Anger,Disgust,Fear,Joy,Sadness,Analytical,Confident,Tentative,Openness,Conscientiousness,Extraversion,Agreeableness,Emotional Range
91,92,B0019CW0HE,A7JWCYVPF7KCO,gare,0,0,5,1334966400,Great dog food,"This is great dog food, my dog has severs allergies and this brand is the only one that we can feed him.",0.04062,0.144101,0.063147,0.47839,0.034847,0.158609,0.0,0.0,0.779342,0.82064,0.303682,0.328041,0.174744
92,93,B0019CW0HE,ABG53EBZBKD23,"J. Romagnoli ""*jroma""",0,0,5,1333929600,Mmmmm  Mmmmm good.,This food is great - all ages dogs.  I have a 3 year old and a puppy.  They are both so soft and hardly ever get sick.  The food is good especially when you have Amazon Prime shipping  :),0.041902,0.05627,0.025006,0.720265,0.17798,0.0,0.340303,0.0,0.495244,0.561294,0.594917,0.776764,0.08914
93,94,B0019CW0HE,A3AF72GP4GVRY1,John D. Meara,0,0,5,1330041600,Great Dog Food!,"My golden retriever is one of the most picky dogs I've ever met.  After experimenting with various types of food, I have found she loves natural balance.  What I really like about natural balance is the fact that it has multiple flavors in dry and wet varieties.  I mix her dry food with a little wet food and my golden loves it.  Furthermore, I do like mixing up the flavors each time as I think the same meal day over day might get a little boring, so I figured why not.  I tend to stay away from the fish type though as it smells...<br /><br />Additionally, I started purchasing off Amazon because Petco didn't have the wet food box and only had a couple of cans.  I came home and to my surprise realized that I could save $20 each time I bought dog food if I just buy it off Amazon.<br /><br />All in all, I definitely recommend and give my stamp of approval to natural balance dog food.  While I have never eaten it, my dog seems to love it.",0.070458,0.085387,0.093946,0.686704,0.559771,0.357235,0.0,0.570221,0.564329,0.590471,0.040954,0.392928,0.166312
94,95,B0019CW0HE,A1DJAAKLPCJRZD,wendy,0,0,5,1329609600,So convenient,This is the same food we get at pet store. But it's delivered to my door! And for the same price or slightly less.,0.365772,0.045029,0.262863,0.019108,0.212478,0.711937,0.0,0.942233,0.457286,0.383742,0.130792,0.381802,0.692021
95,96,B0019CW0HE,A1BFNM27629VAV,E. Triebe,0,0,5,1320105600,Good healthy dog food,I've been very pleased with the Natural Balance dog food. Our dogs have had issues with other dog foods in the past and I had someone recommend Natural Balance grain free since it is possible they were allergic to grains. Since switching I haven't had any issues. It is also helpful that have have different kibble size for larger/smaller sized dogs.,0.045145,0.020145,0.018966,0.581842,0.203654,0.005675,0.0,0.757162,0.93247,0.428124,0.06317,0.19324,0.136637
96,97,B0019CW0HE,A18AAABCIJKC5Q,Rhiever,0,0,5,1303776000,Great dog food,"My 1-1/2 year old basenji/jack russell mix loves this dog food. He's been noticeably healthier and more energetic since I switched him over from the standard dog foods earlier this year. Despite the higher cost of natural dog foods, I find that he eats significantly less of the Natural Balance dog foods and still stays happy and full. On the normal dog foods, he'd eat up to 3 cups of dog food a day (the recommended serving for his size), whereas he only eats about 1 cup to 1-1/2 cup of the Natural Balance dog food a day. When you take this into account, you're actually getting more ""bang for your buck"" with the natural dog foods since you don't have to buy as much to last just as long as the normal dog foods... and a healthier, happier dog, to boot! Add in the fact that you can get free, 2-day shipping with Amazon Prime... I'm sold!!",0.074657,0.130848,0.047821,0.620547,0.167786,0.629417,0.57318,0.0,0.211555,0.58477,0.263009,0.171551,0.449768
97,98,B0019CW0HE,A3UII2114114PI,"FuNky Faja ""SiLkk""",0,0,5,1297296000,"Great allergy sensitive dog food, dogs love it",Our pup has experienced allergies in forms of hotspots and itching from other dog foods. The cheap 'you can buy it anywhere' food not only have crazy preservatives in them but can cause health problems for your pets.  This food works wonders on reducing allergies and our dog loves the food.<br />This message is RAMSEY FrAnkenSteiN approved.,0.050899,0.031981,0.076227,0.58689,0.110218,0.754861,0.0,0.733641,0.616138,0.795298,0.319239,0.315686,0.157617
98,99,B0019CW0HE,ABZ9F0D94YK45,Amazon-tron 3000,0,0,5,1295308800,Perfect for our English Bulldog with Allergies,"My English Bulldog had skin allergies the summer we got him at age 3.  The vet recommended we wean him off the food his previous owner gave him (Iams Lamb and Rice) and onto a new kind.  This was the second one we tried, and it has been working ever since.  It's for dogs that need a limited diet who can be sensitive to additives and proteins commonly found in commercial dog food (like chicken or beef).",0.024374,0.173582,0.049034,0.430704,0.317241,0.168844,0.0,0.800593,0.727607,0.549898,0.006627,0.077756,0.253173
99,100,B0019CW0HE,A2P6ACFZ8FTNVV,Melissa Benjamin,0,1,1,1331164800,Bad,"I fed this to my Golden Retriever and he hated it.  He wouldn't eat it, and when he did, it gave him terrible diarrhea.  We will not be buying this again.  It's also super expensive.",0.606169,0.1557,0.129191,0.010632,0.445873,0.336637,0.0,0.0,0.369396,0.200583,4e-06,0.750372,0.19252
